<?xml version="1.0" encoding="UTF-8" ?>
<!DOCTYPE eSummaryResult PUBLIC "-//NLM//DTD esummary v1 20041029//EN" "https://eutils.ncbi.nlm.nih.gov/eutils/dtd/20041029/esummary-v1.dtd">
<eSummaryResult>
<DocSum>
	<Id>9913</Id>
	<Item Name="Status" Type="String">active</Item>
	<Item Name="Rank" Type="String">species</Item>
	<Item Name="Division" Type="String">even-toed ungulates &amp; whales</Item>
	<Item Name="ScientificName" Type="String">Bos taurus</Item>
	<Item Name="CommonName" Type="String">domestic cattle</Item>
	<Item Name="TaxId" Type="Integer">9913</Item>
	<Item Name="AkaTaxId" Type="Integer">0</Item>
	<Item Name="Genus" Type="String"></Item>
	<Item Name="Species" Type="String"></Item>
	<Item Name="Subsp" Type="String"></Item>
	<Item Name="ModificationDate" Type="Date">2024/08/09 00:00</Item>
</DocSum>

<DocSum>
	<Id>30521</Id>
	<Item Name="Status" Type="String">active</Item>
	<Item Name="Rank" Type="String">species</Item>
	<Item Name="Division" Type="String">even-toed ungulates &amp; whales</Item>
	<Item Name="ScientificName" Type="String">Bos grunniens</Item>
	<Item Name="CommonName" Type="String">domestic yak</Item>
	<Item Name="TaxId" Type="Integer">30521</Item>
	<Item Name="AkaTaxId" Type="Integer">0</Item>
	<Item Name="Genus" Type="String"></Item>
	<Item Name="Species" Type="String"></Item>
	<Item Name="Subsp" Type="String"></Item>
	<Item Name="ModificationDate" Type="Date">2020/04/29 00:00</Item>
</DocSum>

</eSummaryResult>
