<?xml version="1.0" encoding="UTF-8" ?>
<!DOCTYPE eSummaryResult PUBLIC "-//NLM//DTD esummary v1 20041029//EN" "https://eutils.ncbi.nlm.nih.gov/eutils/dtd/20041029/esummary-v1.dtd">
<eSummaryResult>
<DocSum>
	<Id>19923</Id>
	<Item Name="PdbAcc" Type="String">1L5J</Item>
	<Item Name="PdbDescr" Type="String">CRYSTAL STRUCTURE OF E. COLI ACONITASE B</Item>
	<Item Name="EC" Type="String"></Item>
	<Item Name="Resolution" Type="String">2.4</Item>
	<Item Name="ExpMethod" Type="String">X-ray Diffraction</Item>
	<Item Name="PdbClass" Type="String">LYASE</Item>
	<Item Name="PdbDepositDate" Type="String">2002/03/07 00:00</Item>
	<Item Name="MMDBEntryDate" Type="String">2002/07/11 00:00</Item>
	<Item Name="OrganismList" Type="List">
		<Item Name="string" Type="String">Escherichia coli</Item>
	</Item>
	<Item Name="LigCode" Type="String">F3S|TRA</Item>
	<Item Name="LigCount" Type="String">2</Item>
	<Item Name="ModProteinResCount" Type="String">0</Item>
	<Item Name="ModDNAResCount" Type="String">0</Item>
	<Item Name="ModRNAResCount" Type="String">0</Item>
	<Item Name="ProteinChainCount" Type="String"></Item>
	<Item Name="DNAChainCount" Type="String"></Item>
	<Item Name="RNAChainCount" Type="String"></Item>
</DocSum>

<DocSum>
	<Id>12120</Id>
	<Item Name="PdbAcc" Type="String">1B0K</Item>
	<Item Name="PdbDescr" Type="String">S642A:FLUOROCITRATE COMPLEX OF ACONITASE</Item>
	<Item Name="EC" Type="String"></Item>
	<Item Name="Resolution" Type="String">2.5</Item>
	<Item Name="ExpMethod" Type="String">X-ray Diffraction</Item>
	<Item Name="PdbClass" Type="String">LYASE</Item>
	<Item Name="PdbDepositDate" Type="String">1998/11/11 00:00</Item>
	<Item Name="MMDBEntryDate" Type="String">2000/01/24 00:00</Item>
	<Item Name="OrganismList" Type="List">
		<Item Name="string" Type="String">Sus scrofa</Item>
	</Item>
	<Item Name="LigCode" Type="String">FLC|O|SF4</Item>
	<Item Name="LigCount" Type="String">3</Item>
	<Item Name="ModProteinResCount" Type="String">0</Item>
	<Item Name="ModDNAResCount" Type="String">0</Item>
	<Item Name="ModRNAResCount" Type="String">0</Item>
	<Item Name="ProteinChainCount" Type="String"></Item>
	<Item Name="DNAChainCount" Type="String"></Item>
	<Item Name="RNAChainCount" Type="String"></Item>
</DocSum>

</eSummaryResult>
